id,exp_years,diplomes,certifications,hard_skills,soft_skills,langues,localisation,mobilite,disponibilite,full_text
140,11,BTS Informatique,Scrum Master,"['PyTorch', 'Pandas', 'SQL', 'Scikit-learn', 'Hadoop', 'Numpy']","['Travail en équipe', 'Adaptabilité', 'Créativité']","['Français', 'Anglais', 'Espagnol']","Bamako, Mali",Mobile,Immédiate,"Expériences: Data Architect chez AgileTeam (2013-2016). Data Analyst chez DataSolutions (2015-2018). Data Engineer chez CloudInnovate (2017-2018). Diplômes: BTS Informatique. Certifications: Scrum Master. Compétences techniques: PyTorch, Pandas, SQL, Scikit-learn, Hadoop, Numpy. Compétences comportementales: Travail en équipe, Adaptabilité, Créativité. Langues: Français, Anglais, Espagnol. Localisation: Bamako, Mali. Mobilité: Mobile. Disponibilité: Immédiate. Poste recherché: Développeur blockchain."
141,13,Master Design,Aucune,"['Machine Learning', 'SQL', 'R', 'Hadoop', 'Power BI', 'Scikit-learn', 'Deep Learning', 'MongoDB']","['Gestion du temps', 'Leadership', 'Créativité']",['Français'],"Dakar, Sénégal",Pas mobile,Immédiate,"Expériences: Data Engineer chez AgileTeam (2011-2014). Data Engineer chez DataDriven (2013-2016). Data Engineer chez DataDriven (2015-2018). Diplômes: Master Design. Certifications: Aucune. Compétences techniques: Machine Learning, SQL, R, Hadoop, Power BI, Scikit-learn, Deep Learning, MongoDB. Compétences comportementales: Gestion du temps, Leadership, Créativité. Langues: Français. Localisation: Dakar, Sénégal. Mobilité: Pas mobile. Disponibilité: Immédiate. Poste recherché: Ingénieur en Machine Learning."
142,9,Master Marketing Digital,Google Data Engineer,"['PostgreSQL', 'R', 'Pandas', 'NLP', 'Scikit-learn', 'Computer Vision']","['Leadership', 'Esprit critique', 'Empathie']","['Français', 'Arabe']","Lyon, France",Ouvert au télétravail,Dans 1 mois,"Expériences: Data Scientist chez DataSolutions (2015-2016). AI Researcher chez DataDriven (2017-2020). Data Scientist chez TechCorp (2019-2022). Diplômes: Master Marketing Digital. Certifications: Google Data Engineer. Compétences techniques: PostgreSQL, R, Pandas, NLP, Scikit-learn, Computer Vision. Compétences comportementales: Leadership, Esprit critique, Empathie. Langues: Français, Arabe. Localisation: Lyon, France. Mobilité: Ouvert au télétravail. Disponibilité: Dans 1 mois. Poste recherché: Chief Data Officer."
143,14,Master Design,Kubernetes Administrator,"['PostgreSQL', 'PyTorch', 'Hadoop', 'TensorFlow', 'Spark', 'Pandas']","['Pensée analytique', 'Travail en équipe', 'Créativité']",['Français'],"Lyon, France",Ouvert au télétravail,Immédiate,"Expériences: Data Architect chez TechVentures (2010-2012). Data Analyst chez DataDriven (2012-2015). Data Analyst chez TechCorp (2014-2016). Diplômes: Master Design. Certifications: Kubernetes Administrator. Compétences techniques: PostgreSQL, PyTorch, Hadoop, TensorFlow, Spark, Pandas. Compétences comportementales: Pensée analytique, Travail en équipe, Créativité. Langues: Français. Localisation: Lyon, France. Mobilité: Ouvert au télétravail. Disponibilité: Immédiate. Poste recherché: Ingénieur en Machine Learning."
144,7,DUT Réseaux et Télécommunications,Microsoft Azure Administrator,"['Machine Learning', 'NLP', 'Deep Learning', 'TensorFlow', 'SQL', 'Pandas', 'Jupyter', 'NoSQL']","['Résolution de problèmes', 'Pensée analytique', 'Créativité']","['Français', 'Anglais', 'Espagnol']","Casablanca, Maroc",Mobile,Immédiate,"Expériences: ML Engineer chez DigitalFirst (2017-2018). Data Architect chez DigitalFirst (2019-2020). Data Architect chez DigitalFirst (2021-2022). Diplômes: DUT Réseaux et Télécommunications. Certifications: Microsoft Azure Administrator. Compétences techniques: Machine Learning, NLP, Deep Learning, TensorFlow, SQL, Pandas, Jupyter, NoSQL. Compétences comportementales: Résolution de problèmes, Pensée analytique, Créativité. Langues: Français, Anglais, Espagnol. Localisation: Casablanca, Maroc. Mobilité: Mobile. Disponibilité: Immédiate. Poste recherché: Data Architect."
145,6,PhD en Intelligence Artificielle,CEH,"['Tableau', 'Scikit-learn', 'Pandas', 'Numpy', 'NLP', 'PyTorch']","['Gestion du temps', 'Leadership', 'Pensée analytique']","['Français', 'Arabe']","Genève, Suisse",Mobile,Immédiate,"Expériences: AI Researcher chez CloudInnovate (2018-2020). Data Engineer chez TechVentures (2020-2022). Data Architect chez TechCorp (2022-2025). Diplômes: PhD en Intelligence Artificielle. Certifications: CEH. Compétences techniques: Tableau, Scikit-learn, Pandas, Numpy, NLP, PyTorch. Compétences comportementales: Gestion du temps, Leadership, Pensée analytique. Langues: Français, Arabe. Localisation: Genève, Suisse. Mobilité: Mobile. Disponibilité: Immédiate. Poste recherché: Responsable CRM."
146,6,Diplôme d'ingénieur Informatique,HubSpot Marketing,"['Computer Vision', 'Tableau', 'R', 'Power BI', 'PostgreSQL', 'Machine Learning']","['Esprit critique', 'Empathie', 'Pensée analytique']",['Français'],"Montréal, Canada",Ouvert au télétravail,Immédiate,"Expériences: ML Engineer chez StartupHub (2018-2020). ML Engineer chez InnovateLab (2020-2023). Data Architect chez CloudMasters (2022-2024). Diplômes: Diplôme d'ingénieur Informatique. Certifications: HubSpot Marketing. Compétences techniques: Computer Vision, Tableau, R, Power BI, PostgreSQL, Machine Learning. Compétences comportementales: Esprit critique, Empathie, Pensée analytique. Langues: Français. Localisation: Montréal, Canada. Mobilité: Ouvert au télétravail. Disponibilité: Immédiate. Poste recherché: Data Steward."
147,2,Licence Communication,Google Analytics,"['Numpy', 'Power BI', 'Computer Vision', 'Pandas', 'Machine Learning']","['Esprit critique', 'Travail en équipe', 'Empathie']","['Français', 'Anglais']","Lyon, France",Mobile,Immédiate,"Expériences: AI Researcher chez TechCorp (2022-2025). Diplômes: Licence Communication. Certifications: Google Analytics. Compétences techniques: Numpy, Power BI, Computer Vision, Pandas, Machine Learning. Compétences comportementales: Esprit critique, Travail en équipe, Empathie. Langues: Français, Anglais. Localisation: Lyon, France. Mobilité: Mobile. Disponibilité: Immédiate. Poste recherché: Technicien data."
148,4,Master Data Science,Aucune,"['Deep Learning', 'Scikit-learn', 'MongoDB', 'Tableau', 'R', 'Spark', 'Numpy']","['Résolution de problèmes', 'Créativité', 'Pensée analytique']","['Français', 'Anglais', 'Allemand']","Paris, France",Ouvert au télétravail,Immédiate,"Expériences: Data Engineer chez CloudInnovate (2020-2022). AI Researcher chez TechCorp (2022-2025). Diplômes: Master Data Science. Certifications: Aucune. Compétences techniques: Deep Learning, Scikit-learn, MongoDB, Tableau, R, Spark, Numpy. Compétences comportementales: Résolution de problèmes, Créativité, Pensée analytique. Langues: Français, Anglais, Allemand. Localisation: Paris, France. Mobilité: Ouvert au télétravail. Disponibilité: Immédiate. Poste recherché: Développeur IA."
149,8,Licence Informatique,PMP,"['Pandas', 'Deep Learning', 'Computer Vision', 'SQL', 'Hadoop', 'Machine Learning']","['Résolution de problèmes', 'Gestion du temps', 'Créativité']","['Français', 'Arabe']","Casablanca, Maroc",Mobile,Dans 1 mois,"Expériences: Data Engineer chez CloudMasters (2016-2018). Data Scientist chez StartupHub (2018-2020). Data Architect chez AgileTeam (2020-2023). Diplômes: Licence Informatique. Certifications: PMP. Compétences techniques: Pandas, Deep Learning, Computer Vision, SQL, Hadoop, Machine Learning. Compétences comportementales: Résolution de problèmes, Gestion du temps, Créativité. Langues: Français, Arabe. Localisation: Casablanca, Maroc. Mobilité: Mobile. Disponibilité: Dans 1 mois. Poste recherché: Technicien data."
150,4,Master Design,CEH,"['Deep Learning', 'Scikit-learn', 'Numpy', 'Jupyter', 'PostgreSQL', 'Hadoop', 'Computer Vision', 'PyTorch']","['Résolution de problèmes', 'Empathie', 'Communication']","['Français', 'Arabe']","Bruxelles, Belgique",Mobile,Dans 3 mois,"Expériences: Data Analyst chez AgileTeam (2020-2021). ML Engineer chez CloudInnovate (2022-2024). Diplômes: Master Design. Certifications: CEH. Compétences techniques: Deep Learning, Scikit-learn, Numpy, Jupyter, PostgreSQL, Hadoop, Computer Vision, PyTorch. Compétences comportementales: Résolution de problèmes, Empathie, Communication. Langues: Français, Arabe. Localisation: Bruxelles, Belgique. Mobilité: Mobile. Disponibilité: Dans 3 mois. Poste recherché: Gestionnaire de base de données."
151,11,BTS Informatique,Google Data Engineer,"['Tableau', 'Jupyter', 'Hadoop', 'Python', 'TensorFlow', 'NoSQL', 'Spark', 'SQL']","['Communication', 'Pensée analytique', 'Résolution de problèmes']","['Français', 'Anglais', 'Espagnol']","Dakar, Sénégal",Mobile,Dans 3 mois,"Expériences: Data Analyst chez CloudInnovate (2013-2016). Data Scientist chez DevFactory (2015-2018). AI Researcher chez DevFactory (2017-2019). Diplômes: BTS Informatique. Certifications: Google Data Engineer. Compétences techniques: Tableau, Jupyter, Hadoop, Python, TensorFlow, NoSQL, Spark, SQL. Compétences comportementales: Communication, Pensée analytique, Résolution de problèmes. Langues: Français, Anglais, Espagnol. Localisation: Dakar, Sénégal. Mobilité: Mobile. Disponibilité: Dans 3 mois. Poste recherché: Architecte base de données."
152,4,DUT Réseaux et Télécommunications,PMP,"['PostgreSQL', 'Tableau', 'MongoDB', 'Scikit-learn', 'Computer Vision', 'PyTorch', 'Machine Learning']","['Empathie', 'Résolution de problèmes', 'Pensée analytique']","['Anglais', 'Espagnol']","Lyon, France",Mobile,Dans 1 mois,"Expériences: Data Scientist chez DataSolutions (2020-2023). ML Engineer chez TechVentures (2022-2023). Diplômes: DUT Réseaux et Télécommunications. Certifications: PMP. Compétences techniques: PostgreSQL, Tableau, MongoDB, Scikit-learn, Computer Vision, PyTorch, Machine Learning. Compétences comportementales: Empathie, Résolution de problèmes, Pensée analytique. Langues: Anglais, Espagnol. Localisation: Lyon, France. Mobilité: Mobile. Disponibilité: Dans 1 mois. Poste recherché: Architecte blockchain."
153,6,Master Marketing Digital,Adobe Certified Expert,"['Jupyter', 'Hadoop', 'Computer Vision', 'NLP', 'Deep Learning', 'Spark', 'MongoDB']","['Esprit critique', 'Gestion du temps', 'Leadership']","['Français', 'Anglais']","Tunis, Tunisie",Mobile,Immédiate,"Expériences: AI Researcher chez AgileTeam (2018-2021). Data Engineer chez DigitalFirst (2020-2022). Data Engineer chez CloudInnovate (2022-2024). Diplômes: Master Marketing Digital. Certifications: Adobe Certified Expert. Compétences techniques: Jupyter, Hadoop, Computer Vision, NLP, Deep Learning, Spark, MongoDB. Compétences comportementales: Esprit critique, Gestion du temps, Leadership. Langues: Français, Anglais. Localisation: Tunis, Tunisie. Mobilité: Mobile. Disponibilité: Immédiate. Poste recherché: Architecte base de données."
154,3,Licence Informatique,CEH,"['Tableau', 'Jupyter', 'Power BI', 'Machine Learning', 'NoSQL']","['Adaptabilité', 'Leadership', 'Pensée analytique']",['Français'],"Casablanca, Maroc",Ouvert au télétravail,Dans 1 mois,"Expériences: AI Researcher chez SmartTech (2021-2023). Diplômes: Licence Informatique. Certifications: CEH. Compétences techniques: Tableau, Jupyter, Power BI, Machine Learning, NoSQL. Compétences comportementales: Adaptabilité, Leadership, Pensée analytique. Langues: Français. Localisation: Casablanca, Maroc. Mobilité: Ouvert au télétravail. Disponibilité: Dans 1 mois. Poste recherché: Technicien base de données."
155,12,Diplôme d'ingénieur Informatique,Kubernetes Administrator,"['Deep Learning', 'Computer Vision', 'TensorFlow', 'MongoDB', 'PostgreSQL', 'Power BI', 'PyTorch']","['Créativité', 'Travail en équipe', 'Résolution de problèmes']","['Français', 'Anglais']","Montréal, Canada",Ouvert au télétravail,Dans 3 mois,"Expériences: Data Architect chez DataDriven (2012-2014). Data Engineer chez DataDriven (2014-2016). Data Analyst chez StartupHub (2016-2018). Diplômes: Diplôme d'ingénieur Informatique. Certifications: Kubernetes Administrator. Compétences techniques: Deep Learning, Computer Vision, TensorFlow, MongoDB, PostgreSQL, Power BI, PyTorch. Compétences comportementales: Créativité, Travail en équipe, Résolution de problèmes. Langues: Français, Anglais. Localisation: Montréal, Canada. Mobilité: Ouvert au télétravail. Disponibilité: Dans 3 mois. Poste recherché: Architecte base de données."
156,15,MBA Management Digital,Scrum Master,"['Pandas', 'MongoDB', 'Deep Learning', 'Python', 'Scikit-learn', 'NoSQL']","['Gestion du temps', 'Résolution de problèmes', 'Empathie']","['Français', 'Anglais', 'Espagnol']","Tunis, Tunisie",Pas mobile,Dans 1 mois,"Expériences: Data Scientist chez InnovateLab (2009-2011). Data Analyst chez DataDriven (2011-2014). Data Engineer chez CloudMasters (2013-2016). Diplômes: MBA Management Digital. Certifications: Scrum Master. Compétences techniques: Pandas, MongoDB, Deep Learning, Python, Scikit-learn, NoSQL. Compétences comportementales: Gestion du temps, Résolution de problèmes, Empathie. Langues: Français, Anglais, Espagnol. Localisation: Tunis, Tunisie. Mobilité: Pas mobile. Disponibilité: Dans 1 mois. Poste recherché: Data Miner."
157,3,Diplôme d'ingénieur Logiciel,CEH,"['Deep Learning', 'Pandas', 'PyTorch', 'TensorFlow', 'PostgreSQL', 'SQL']","['Gestion du temps', 'Résolution de problèmes', 'Esprit critique']","['Français', 'Arabe']","Paris, France",Ouvert au télétravail,Dans 1 mois,"Expériences: Data Analyst chez SmartTech (2021-2022). Diplômes: Diplôme d'ingénieur Logiciel. Certifications: CEH. Compétences techniques: Deep Learning, Pandas, PyTorch, TensorFlow, PostgreSQL, SQL. Compétences comportementales: Gestion du temps, Résolution de problèmes, Esprit critique. Langues: Français, Arabe. Localisation: Paris, France. Mobilité: Ouvert au télétravail. Disponibilité: Dans 1 mois. Poste recherché: Technicien base de données."
158,6,Master Data Science,HubSpot Marketing,"['Pandas', 'Numpy', 'Machine Learning', 'SQL', 'NoSQL', 'Hadoop']","['Adaptabilité', 'Esprit critique', 'Travail en équipe']",['Français'],"Lyon, France",Pas mobile,Dans 1 mois,"Expériences: Data Engineer chez TechVentures (2018-2020). Data Scientist chez InnovateLab (2020-2021). Data Engineer chez InnovateLab (2022-2025). Diplômes: Master Data Science. Certifications: HubSpot Marketing. Compétences techniques: Pandas, Numpy, Machine Learning, SQL, NoSQL, Hadoop. Compétences comportementales: Adaptabilité, Esprit critique, Travail en équipe. Langues: Français. Localisation: Lyon, France. Mobilité: Pas mobile. Disponibilité: Dans 1 mois. Poste recherché: Architecte base de données."
159,10,PhD en Intelligence Artificielle,Microsoft Azure Administrator,"['R', 'Power BI', 'TensorFlow', 'Python', 'Scikit-learn', 'Pandas', 'Tableau', 'Hadoop']","['Adaptabilité', 'Gestion du temps', 'Résolution de problèmes']","['Français', 'Arabe']","Bamako, Mali",Pas mobile,Immédiate,"Expériences: Data Scientist chez TechCorp (2014-2015). ML Engineer chez CloudInnovate (2016-2017). ML Engineer chez TechVentures (2018-2020). Diplômes: PhD en Intelligence Artificielle. Certifications: Microsoft Azure Administrator. Compétences techniques: R, Power BI, TensorFlow, Python, Scikit-learn, Pandas, Tableau, Hadoop. Compétences comportementales: Adaptabilité, Gestion du temps, Résolution de problèmes. Langues: Français, Arabe. Localisation: Bamako, Mali. Mobilité: Pas mobile. Disponibilité: Immédiate. Poste recherché: Technicien data."
160,13,Master Data Science,Kubernetes Administrator,"['PostgreSQL', 'Spark', 'Hadoop', 'SQL', 'MongoDB']","['Communication', 'Créativité', 'Empathie']","['Français', 'Anglais']","Montréal, Canada",Pas mobile,Dans 3 mois,"Expériences: Data Engineer chez TechCorp (2011-2012). AI Researcher chez DevFactory (2013-2015). Data Architect chez DataDriven (2015-2018). Diplômes: Master Data Science. Certifications: Kubernetes Administrator. Compétences techniques: PostgreSQL, Spark, Hadoop, SQL, MongoDB. Compétences comportementales: Communication, Créativité, Empathie. Langues: Français, Anglais. Localisation: Montréal, Canada. Mobilité: Pas mobile. Disponibilité: Dans 3 mois. Poste recherché: Chief Data Officer."
161,6,DUT Réseaux et Télécommunications,Google Data Engineer,"['Hadoop', 'TensorFlow', 'R', 'Machine Learning', 'Python', 'SQL']","['Adaptabilité', 'Empathie', 'Esprit critique']","['Anglais', 'Espagnol']","Genève, Suisse",Ouvert au télétravail,Immédiate,"Expériences: Data Engineer chez CloudInnovate (2018-2020). Data Engineer chez SmartTech (2020-2022). ML Engineer chez SmartTech (2022-2024). Diplômes: DUT Réseaux et Télécommunications. Certifications: Google Data Engineer. Compétences techniques: Hadoop, TensorFlow, R, Machine Learning, Python, SQL. Compétences comportementales: Adaptabilité, Empathie, Esprit critique. Langues: Anglais, Espagnol. Localisation: Genève, Suisse. Mobilité: Ouvert au télétravail. Disponibilité: Immédiate. Poste recherché: Architecte blockchain."
162,10,Master Design,PMP,"['PostgreSQL', 'Numpy', 'NLP', 'Scikit-learn', 'Hadoop', 'TensorFlow']","['Communication', 'Résolution de problèmes', 'Pensée analytique']","['Français', 'Anglais']","Tunis, Tunisie",Ouvert au télétravail,Immédiate,"Expériences: Data Analyst chez AgileTeam (2014-2016). Data Analyst chez StartupHub (2016-2018). Data Analyst chez DataDriven (2018-2021). Diplômes: Master Design. Certifications: PMP. Compétences techniques: PostgreSQL, Numpy, NLP, Scikit-learn, Hadoop, TensorFlow. Compétences comportementales: Communication, Résolution de problèmes, Pensée analytique. Langues: Français, Anglais. Localisation: Tunis, Tunisie. Mobilité: Ouvert au télétravail. Disponibilité: Immédiate. Poste recherché: Technicien data."
163,5,Master Marketing Digital,Aucune,"['Machine Learning', 'Hadoop', 'TensorFlow', 'NoSQL', 'NLP']","['Gestion du temps', 'Empathie', 'Adaptabilité']",['Français'],"Dakar, Sénégal",Mobile,Dans 3 mois,"Expériences: ML Engineer chez TechCorp (2019-2020). ML Engineer chez StartupHub (2021-2022). Diplômes: Master Marketing Digital. Certifications: Aucune. Compétences techniques: Machine Learning, Hadoop, TensorFlow, NoSQL, NLP. Compétences comportementales: Gestion du temps, Empathie, Adaptabilité. Langues: Français. Localisation: Dakar, Sénégal. Mobilité: Mobile. Disponibilité: Dans 3 mois. Poste recherché: Ingénieur en Machine Learning."
164,1,PhD en Intelligence Artificielle,CEH,"['Tableau', 'Power BI', 'PyTorch', 'Computer Vision', 'Machine Learning', 'SQL', 'Numpy']","['Résolution de problèmes', 'Leadership', 'Pensée analytique']",['Français'],"Genève, Suisse",Ouvert au télétravail,Dans 1 mois,"Expériences: AI Researcher chez SmartTech (2023-2025). Diplômes: PhD en Intelligence Artificielle. Certifications: CEH. Compétences techniques: Tableau, Power BI, PyTorch, Computer Vision, Machine Learning, SQL, Numpy. Compétences comportementales: Résolution de problèmes, Leadership, Pensée analytique. Langues: Français. Localisation: Genève, Suisse. Mobilité: Ouvert au télétravail. Disponibilité: Dans 1 mois. Poste recherché: Architecte base de données."
165,10,Master Marketing Digital,Google Data Engineer,"['NLP', 'Tableau', 'SQL', 'MongoDB', 'Machine Learning', 'R', 'Python', 'Jupyter']","['Adaptabilité', 'Travail en équipe', 'Leadership']",['Français'],"Tunis, Tunisie",Mobile,Immédiate,"Expériences: ML Engineer chez DigitalFirst (2014-2015). Data Scientist chez DevFactory (2016-2017). Data Analyst chez CloudInnovate (2018-2020). Diplômes: Master Marketing Digital. Certifications: Google Data Engineer. Compétences techniques: NLP, Tableau, SQL, MongoDB, Machine Learning, R, Python, Jupyter. Compétences comportementales: Adaptabilité, Travail en équipe, Leadership. Langues: Français. Localisation: Tunis, Tunisie. Mobilité: Mobile. Disponibilité: Immédiate. Poste recherché: Technicien blockchain."
166,1,Master Data Science,Scrum Master,"['NLP', 'Power BI', 'Python', 'Computer Vision', 'Scikit-learn']","['Leadership', 'Résolution de problèmes', 'Esprit critique']","['Français', 'Anglais']","Montréal, Canada",Mobile,Dans 1 mois,"Expériences: Data Architect chez AgileTeam (2023-2024). Diplômes: Master Data Science. Certifications: Scrum Master. Compétences techniques: NLP, Power BI, Python, Computer Vision, Scikit-learn. Compétences comportementales: Leadership, Résolution de problèmes, Esprit critique. Langues: Français, Anglais. Localisation: Montréal, Canada. Mobilité: Mobile. Disponibilité: Dans 1 mois. Poste recherché: Data Steward."
167,8,Master Marketing Digital,Kubernetes Administrator,"['Python', 'Angular', 'C#', 'Git', 'Node.js']","['Communication', 'Pensée analytique', 'Empathie']",['Français'],"Paris, France",Mobile,Immédiate,"Expériences: Développeur Full Stack chez SmartTech (2016-2018). Développeur Full Stack chez DataSolutions (2018-2020). Développeur Full Stack chez DataDriven (2020-2023). Diplômes: Master Marketing Digital. Certifications: Kubernetes Administrator. Compétences techniques: Python, Angular, C#, Git, Node.js. Compétences comportementales: Communication, Pensée analytique, Empathie. Langues: Français. Localisation: Paris, France. Mobilité: Mobile. Disponibilité: Immédiate. Poste recherché: Testeur."
168,8,Diplôme d'ingénieur Logiciel,PMP,"['Flask', 'Agile', 'CI/CD', 'Jenkins', 'Django', 'Vue.js', 'REST API']","['Leadership', 'Empathie', 'Pensée analytique']",['Français'],"Bamako, Mali",Ouvert au télétravail,Dans 1 mois,"Expériences: Développeur Frontend chez AgileTeam (2016-2019). Développeur Backend chez TechVentures (2018-2020). Tech Lead chez CloudMasters (2020-2022). Diplômes: Diplôme d'ingénieur Logiciel. Certifications: PMP. Compétences techniques: Flask, Agile, CI/CD, Jenkins, Django, Vue.js, REST API. Compétences comportementales: Leadership, Empathie, Pensée analytique. Langues: Français. Localisation: Bamako, Mali. Mobilité: Ouvert au télétravail. Disponibilité: Dans 1 mois. Poste recherché: Testeur."
169,5,Master Marketing Digital,CISSP,"['Scrum', 'Java', 'React', 'CI/CD', 'Django', 'Spring Boot']","['Esprit critique', 'Communication', 'Empathie']","['Français', 'Anglais', 'Espagnol']","Tunis, Tunisie",Mobile,Dans 3 mois,"Expériences: Développeur Frontend chez InnovateLab (2019-2022). Tech Lead chez SmartTech (2021-2024). Diplômes: Master Marketing Digital. Certifications: CISSP. Compétences techniques: Scrum, Java, React, CI/CD, Django, Spring Boot. Compétences comportementales: Esprit critique, Communication, Empathie. Langues: Français, Anglais, Espagnol. Localisation: Tunis, Tunisie. Mobilité: Mobile. Disponibilité: Dans 3 mois. Poste recherché: Développeur d'applications."
170,10,Master Informatique,Kubernetes Administrator,"['JavaScript', 'GraphQL', 'CI/CD', 'PHP', 'Angular', 'React']","['Résolution de problèmes', 'Adaptabilité', 'Esprit critique']","['Français', 'Arabe']","Paris, France",Ouvert au télétravail,Dans 1 mois,"Expériences: Tech Lead chez StartupHub (2014-2016). Développeur Frontend chez DataDriven (2016-2017). Architecte logiciel chez InnovateLab (2018-2020). Diplômes: Master Informatique. Certifications: Kubernetes Administrator. Compétences techniques: JavaScript, GraphQL, CI/CD, PHP, Angular, React. Compétences comportementales: Résolution de problèmes, Adaptabilité, Esprit critique. Langues: Français, Arabe. Localisation: Paris, France. Mobilité: Ouvert au télétravail. Disponibilité: Dans 1 mois. Poste recherché: Développeur Web / Mobile."
171,4,Diplôme d'ingénieur Informatique,Adobe Certified Expert,"['Python', 'Java', 'GraphQL', 'Docker', 'React', 'CI/CD', 'REST API']","['Travail en équipe', 'Adaptabilité', 'Empathie']",['Français'],"Bamako, Mali",Pas mobile,Dans 3 mois,"Expériences: Développeur Full Stack chez DevFactory (2020-2022). Architecte logiciel chez InnovateLab (2022-2024). Diplômes: Diplôme d'ingénieur Informatique. Certifications: Adobe Certified Expert. Compétences techniques: Python, Java, GraphQL, Docker, React, CI/CD, REST API. Compétences comportementales: Travail en équipe, Adaptabilité, Empathie. Langues: Français. Localisation: Bamako, Mali. Mobilité: Pas mobile. Disponibilité: Dans 3 mois. Poste recherché: Ingénieur logiciel."
172,2,Master Informatique,CISSP,"['GraphQL', 'Python', 'REST API', 'Vue.js', 'Flask', 'PHP', 'TypeScript', 'Java']","['Esprit critique', 'Leadership', 'Pensée analytique']","['Français', 'Anglais', 'Allemand']","Paris, France",Pas mobile,Dans 1 mois,"Expériences: Développeur Backend chez DataSolutions (2022-2025). Diplômes: Master Informatique. Certifications: CISSP. Compétences techniques: GraphQL, Python, REST API, Vue.js, Flask, PHP, TypeScript, Java. Compétences comportementales: Esprit critique, Leadership, Pensée analytique. Langues: Français, Anglais, Allemand. Localisation: Paris, France. Mobilité: Pas mobile. Disponibilité: Dans 1 mois. Poste recherché: Developpeur Front-End."
