id,exp_years,diplomes,certifications,hard_skills,soft_skills,langues,localisation,mobilite,disponibilite,full_text
237,4,DUT Réseaux et Télécommunications,PMP,"['Design Thinking', 'Prototyping', 'Photoshop', 'Illustrator', 'After Effects', 'Wireframing']","['Pensée analytique', 'Empathie', 'Résolution de problèmes']","['Français', 'Anglais']","Tunis, Tunisie",Mobile,Dans 3 mois,"Expériences: UI Designer chez StartupHub (2020-2022). Graphiste chez TechVentures (2022-2023). Diplômes: DUT Réseaux et Télécommunications. Certifications: PMP. Compétences techniques: Design Thinking, Prototyping, Photoshop, Illustrator, After Effects, Wireframing. Compétences comportementales: Pensée analytique, Empathie, Résolution de problèmes. Langues: Français, Anglais. Localisation: Tunis, Tunisie. Mobilité: Mobile. Disponibilité: Dans 3 mois. Poste recherché: Level designer."
238,8,PhD en Intelligence Artificielle,HubSpot Marketing,"['Illustrator', 'CSS', 'Figma', 'UX Design', 'Unreal Engine', 'Premiere Pro', 'Adobe XD']","['Gestion du temps', 'Empathie', 'Adaptabilité']","['Français', 'Anglais']","Lyon, France",Pas mobile,Immédiate,"Expériences: Directeur artistique chez TechCorp (2016-2019). Motion Designer chez CloudInnovate (2018-2020). UX Designer chez DigitalFirst (2020-2021). Diplômes: PhD en Intelligence Artificielle. Certifications: HubSpot Marketing. Compétences techniques: Illustrator, CSS, Figma, UX Design, Unreal Engine, Premiere Pro, Adobe XD. Compétences comportementales: Gestion du temps, Empathie, Adaptabilité. Langues: Français, Anglais. Localisation: Lyon, France. Mobilité: Pas mobile. Disponibilité: Immédiate. Poste recherché: Développeur de jeux vidéos."
239,9,Licence Communication,PMP,"['CSS', 'Premiere Pro', 'Adobe XD', 'Design Thinking', 'Wireframing']","['Gestion du temps', 'Créativité', 'Pensée analytique']","['Anglais', 'Espagnol']","Bamako, Mali",Mobile,Dans 1 mois,"Expériences: Graphiste chez SmartTech (2015-2017). Directeur artistique chez AgileTeam (2017-2019). Directeur artistique chez AgileTeam (2019-2022). Diplômes: Licence Communication. Certifications: PMP. Compétences techniques: CSS, Premiere Pro, Adobe XD, Design Thinking, Wireframing. Compétences comportementales: Gestion du temps, Créativité, Pensée analytique. Langues: Anglais, Espagnol. Localisation: Bamako, Mali. Mobilité: Mobile. Disponibilité: Dans 1 mois. Poste recherché: Développeur gameplay."
240,8,Master Marketing Digital,Aucune,"['Illustrator', 'Adobe XD', 'Sketch', 'UX Design', 'Photoshop', 'After Effects']","['Gestion du temps', 'Travail en équipe', 'Pensée analytique']","['Anglais', 'Espagnol']","Tunis, Tunisie",Mobile,Immédiate,"Expériences: Game Designer chez TechVentures (2016-2019). Directeur artistique chez DevFactory (2018-2019). Motion Designer chez DevFactory (2020-2021). Diplômes: Master Marketing Digital. Certifications: Aucune. Compétences techniques: Illustrator, Adobe XD, Sketch, UX Design, Photoshop, After Effects. Compétences comportementales: Gestion du temps, Travail en équipe, Pensée analytique. Langues: Anglais, Espagnol. Localisation: Tunis, Tunisie. Mobilité: Mobile. Disponibilité: Immédiate. Poste recherché: Programmeur de jeux vidéo."
241,10,Licence Communication,Microsoft Azure Administrator,"['Figma', 'CSS', 'InDesign', 'Prototyping', 'Blender']","['Leadership', 'Pensée analytique', 'Communication']","['Français', 'Anglais', 'Allemand']","Tunis, Tunisie",Ouvert au télétravail,Immédiate,"Expériences: Webdesigner chez CloudMasters (2014-2016). UX Designer chez StartupHub (2016-2018). Game Designer chez TechVentures (2018-2020). Diplômes: Licence Communication. Certifications: Microsoft Azure Administrator. Compétences techniques: Figma, CSS, InDesign, Prototyping, Blender. Compétences comportementales: Leadership, Pensée analytique, Communication. Langues: Français, Anglais, Allemand. Localisation: Tunis, Tunisie. Mobilité: Ouvert au télétravail. Disponibilité: Immédiate. Poste recherché: UX Designer."
242,5,Diplôme d'ingénieur Logiciel,HubSpot Marketing,"['Design Thinking', 'Wireframing', 'CSS', 'Figma', 'After Effects', 'Adobe XD', 'UX Design']","['Adaptabilité', 'Communication', 'Créativité']","['Français', 'Anglais']","Bruxelles, Belgique",Mobile,Immédiate,"Expériences: Directeur artistique chez CloudMasters (2019-2022). Motion Designer chez TechCorp (2021-2024). Diplômes: Diplôme d'ingénieur Logiciel. Certifications: HubSpot Marketing. Compétences techniques: Design Thinking, Wireframing, CSS, Figma, After Effects, Adobe XD, UX Design. Compétences comportementales: Adaptabilité, Communication, Créativité. Langues: Français, Anglais. Localisation: Bruxelles, Belgique. Mobilité: Mobile. Disponibilité: Immédiate. Poste recherché: Game designer."
243,12,Diplôme d'ingénieur Logiciel,CISSP,"['Premiere Pro', 'Figma', 'InDesign', 'Wireframing', 'After Effects', 'UX Design']","['Esprit critique', 'Résolution de problèmes', 'Pensée analytique']",['Français'],"Bruxelles, Belgique",Ouvert au télétravail,Dans 1 mois,"Expériences: Graphiste chez CloudInnovate (2012-2014). UX Designer chez SmartTech (2014-2015). Graphiste chez SmartTech (2016-2019). Diplômes: Diplôme d'ingénieur Logiciel. Certifications: CISSP. Compétences techniques: Premiere Pro, Figma, InDesign, Wireframing, After Effects, UX Design. Compétences comportementales: Esprit critique, Résolution de problèmes, Pensée analytique. Langues: Français. Localisation: Bruxelles, Belgique. Mobilité: Ouvert au télétravail. Disponibilité: Dans 1 mois. Poste recherché: Motion Designer."
244,9,DUT Réseaux et Télécommunications,CISSP,"['Unreal Engine', 'Sketch', 'Illustrator', 'UI Design', 'InDesign', 'After Effects', 'Premiere Pro', 'Blender']","['Esprit critique', 'Pensée analytique', 'Communication']","['Anglais', 'Espagnol']","Bamako, Mali",Pas mobile,Dans 1 mois,"Expériences: UX Designer chez DigitalFirst (2015-2016). UI Designer chez InnovateLab (2017-2018). UI Designer chez TechCorp (2019-2021). Diplômes: DUT Réseaux et Télécommunications. Certifications: CISSP. Compétences techniques: Unreal Engine, Sketch, Illustrator, UI Design, InDesign, After Effects, Premiere Pro, Blender. Compétences comportementales: Esprit critique, Pensée analytique, Communication. Langues: Anglais, Espagnol. Localisation: Bamako, Mali. Mobilité: Pas mobile. Disponibilité: Dans 1 mois. Poste recherché: Réalisateur de jeux vidéos."
245,10,Master Marketing Digital,Scrum Master,"['CSS', 'Photoshop', 'Blender', 'UI Design', 'Prototyping', 'Design Thinking', 'Unity']","['Esprit critique', 'Adaptabilité', 'Travail en équipe']","['Français', 'Anglais', 'Allemand']","Lyon, France",Pas mobile,Dans 3 mois,"Expériences: Directeur artistique chez InnovateLab (2014-2015). Motion Designer chez TechVentures (2016-2018). UI Designer chez CloudMasters (2018-2021). Diplômes: Master Marketing Digital. Certifications: Scrum Master. Compétences techniques: CSS, Photoshop, Blender, UI Design, Prototyping, Design Thinking, Unity. Compétences comportementales: Esprit critique, Adaptabilité, Travail en équipe. Langues: Français, Anglais, Allemand. Localisation: Lyon, France. Mobilité: Pas mobile. Disponibilité: Dans 3 mois. Poste recherché: Graphiste."
246,8,MBA Management Digital,CISSP,"['Unity', 'HTML', 'Unreal Engine', 'Design Thinking', 'Blender', 'Sketch', 'Adobe XD', 'Photoshop']","['Pensée analytique', 'Résolution de problèmes', 'Adaptabilité']","['Français', 'Arabe']","Genève, Suisse",Mobile,Dans 1 mois,"Expériences: UI Designer chez DataDriven (2016-2017). Graphiste chez DataDriven (2018-2019). Game Designer chez CloudMasters (2020-2021). Diplômes: MBA Management Digital. Certifications: CISSP. Compétences techniques: Unity, HTML, Unreal Engine, Design Thinking, Blender, Sketch, Adobe XD, Photoshop. Compétences comportementales: Pensée analytique, Résolution de problèmes, Adaptabilité. Langues: Français, Arabe. Localisation: Genève, Suisse. Mobilité: Mobile. Disponibilité: Dans 1 mois. Poste recherché: UX Designer."
247,2,DUT Réseaux et Télécommunications,Kubernetes Administrator,"['Unity', 'After Effects', 'Wireframing', 'Blender', 'HTML', 'Adobe XD', 'Premiere Pro']","['Leadership', 'Communication', 'Résolution de problèmes']","['Français', 'Anglais', 'Espagnol']","Tunis, Tunisie",Ouvert au télétravail,Immédiate,"Expériences: Game Designer chez InnovateLab (2022-2024). Diplômes: DUT Réseaux et Télécommunications. Certifications: Kubernetes Administrator. Compétences techniques: Unity, After Effects, Wireframing, Blender, HTML, Adobe XD, Premiere Pro. Compétences comportementales: Leadership, Communication, Résolution de problèmes. Langues: Français, Anglais, Espagnol. Localisation: Tunis, Tunisie. Mobilité: Ouvert au télétravail. Disponibilité: Immédiate. Poste recherché: Développeur de jeux vidéos."
248,3,Licence Informatique,Google Data Engineer,"['Figma', 'Unity', 'InDesign', 'Premiere Pro', 'Illustrator', 'Prototyping', 'Blender']","['Créativité', 'Empathie', 'Gestion du temps']","['Français', 'Anglais', 'Allemand']","Bruxelles, Belgique",Pas mobile,Immédiate,"Expériences: Graphiste chez SmartTech (2021-2022). Diplômes: Licence Informatique. Certifications: Google Data Engineer. Compétences techniques: Figma, Unity, InDesign, Premiere Pro, Illustrator, Prototyping, Blender. Compétences comportementales: Créativité, Empathie, Gestion du temps. Langues: Français, Anglais, Allemand. Localisation: Bruxelles, Belgique. Mobilité: Pas mobile. Disponibilité: Immédiate. Poste recherché: UI Designer."
249,10,Master Design,Microsoft Azure Administrator,"['Prototyping', 'Sketch', 'Wireframing', 'Photoshop', 'HTML']","['Travail en équipe', 'Empathie', 'Esprit critique']","['Anglais', 'Espagnol']","Dakar, Sénégal",Ouvert au télétravail,Dans 1 mois,"Expériences: Motion Designer chez DevFactory (2014-2016). Game Designer chez DataSolutions (2016-2018). Game Designer chez InnovateLab (2018-2020). Diplômes: Master Design. Certifications: Microsoft Azure Administrator. Compétences techniques: Prototyping, Sketch, Wireframing, Photoshop, HTML. Compétences comportementales: Travail en équipe, Empathie, Esprit critique. Langues: Anglais, Espagnol. Localisation: Dakar, Sénégal. Mobilité: Ouvert au télétravail. Disponibilité: Dans 1 mois. Poste recherché: Réalisateur de jeux vidéos."
250,13,MBA Management Digital,AWS Certified Solutions Architect,"['Adobe XD', 'UI Design', 'Blender', 'Wireframing', 'HTML', 'Photoshop', 'Figma', 'Premiere Pro']","['Adaptabilité', 'Gestion du temps', 'Empathie']","['Français', 'Anglais']","Paris, France",Mobile,Dans 3 mois,"Expériences: UI Designer chez StartupHub (2011-2012). UX Designer chez InnovateLab (2013-2014). Motion Designer chez StartupHub (2015-2018). Diplômes: MBA Management Digital. Certifications: AWS Certified Solutions Architect. Compétences techniques: Adobe XD, UI Design, Blender, Wireframing, HTML, Photoshop, Figma, Premiere Pro. Compétences comportementales: Adaptabilité, Gestion du temps, Empathie. Langues: Français, Anglais. Localisation: Paris, France. Mobilité: Mobile. Disponibilité: Dans 3 mois. Poste recherché: Forgeur numérique."
251,8,Master Informatique,AWS Certified Solutions Architect,"['Illustrator', 'Wireframing', 'Adobe XD', 'Blender', 'Photoshop', 'UI Design', 'Design Thinking', 'Sketch']","['Travail en équipe', 'Leadership', 'Esprit critique']","['Français', 'Anglais', 'Espagnol']","Casablanca, Maroc",Pas mobile,Immédiate,"Expériences: UX Designer chez CloudInnovate (2016-2019). Directeur artistique chez TechVentures (2018-2021). Game Designer chez CloudInnovate (2020-2021). Diplômes: Master Informatique. Certifications: AWS Certified Solutions Architect. Compétences techniques: Illustrator, Wireframing, Adobe XD, Blender, Photoshop, UI Design, Design Thinking, Sketch. Compétences comportementales: Travail en équipe, Leadership, Esprit critique. Langues: Français, Anglais, Espagnol. Localisation: Casablanca, Maroc. Mobilité: Pas mobile. Disponibilité: Immédiate. Poste recherché: UX Designer."
252,7,PhD en Intelligence Artificielle,CISSP,"['Figma', 'Wireframing', 'Blender', 'Design Thinking', 'After Effects', 'Premiere Pro', 'Unreal Engine']","['Empathie', 'Résolution de problèmes', 'Leadership']","['Anglais', 'Espagnol']","Genève, Suisse",Mobile,Dans 3 mois,"Expériences: Game Designer chez DataDriven (2017-2018). UI Designer chez CloudMasters (2019-2021). Motion Designer chez CloudInnovate (2021-2022). Diplômes: PhD en Intelligence Artificielle. Certifications: CISSP. Compétences techniques: Figma, Wireframing, Blender, Design Thinking, After Effects, Premiere Pro, Unreal Engine. Compétences comportementales: Empathie, Résolution de problèmes, Leadership. Langues: Anglais, Espagnol. Localisation: Genève, Suisse. Mobilité: Mobile. Disponibilité: Dans 3 mois. Poste recherché: Forgeur numérique."
253,11,Licence Informatique,Microsoft Azure Administrator,"['Figma', 'UX Design', 'Premiere Pro', 'After Effects', 'Design Thinking', 'Illustrator', 'InDesign', 'Blender']","['Leadership', 'Pensée analytique', 'Adaptabilité']","['Français', 'Anglais', 'Espagnol']","Tunis, Tunisie",Ouvert au télétravail,Dans 3 mois,"Expériences: Directeur artistique chez DigitalFirst (2013-2014). UX Designer chez CloudMasters (2015-2018). UX Designer chez AgileTeam (2017-2020). Diplômes: Licence Informatique. Certifications: Microsoft Azure Administrator. Compétences techniques: Figma, UX Design, Premiere Pro, After Effects, Design Thinking, Illustrator, InDesign, Blender. Compétences comportementales: Leadership, Pensée analytique, Adaptabilité. Langues: Français, Anglais, Espagnol. Localisation: Tunis, Tunisie. Mobilité: Ouvert au télétravail. Disponibilité: Dans 3 mois. Poste recherché: Développeur gameplay."
254,5,Master Informatique,CISSP,"['Adobe XD', 'UI Design', 'After Effects', 'Prototyping', 'InDesign']","['Pensée analytique', 'Esprit critique', 'Leadership']",['Français'],"Bruxelles, Belgique",Ouvert au télétravail,Immédiate,"Expériences: Game Designer chez AgileTeam (2019-2022). Directeur artistique chez TechCorp (2021-2024). Diplômes: Master Informatique. Certifications: CISSP. Compétences techniques: Adobe XD, UI Design, After Effects, Prototyping, InDesign. Compétences comportementales: Pensée analytique, Esprit critique, Leadership. Langues: Français. Localisation: Bruxelles, Belgique. Mobilité: Ouvert au télétravail. Disponibilité: Immédiate. Poste recherché: Développeur de jeux vidéos."
255,1,PhD en Intelligence Artificielle,Microsoft Azure Administrator,"['Wireframing', 'Adobe XD', 'Unreal Engine', 'Figma', 'CSS', 'Prototyping', 'Premiere Pro', 'Unity']","['Esprit critique', 'Leadership', 'Empathie']","['Français', 'Anglais', 'Allemand']","Dakar, Sénégal",Ouvert au télétravail,Dans 3 mois,"Expériences: UX Designer chez DigitalFirst (2023-2025). Diplômes: PhD en Intelligence Artificielle. Certifications: Microsoft Azure Administrator. Compétences techniques: Wireframing, Adobe XD, Unreal Engine, Figma, CSS, Prototyping, Premiere Pro, Unity. Compétences comportementales: Esprit critique, Leadership, Empathie. Langues: Français, Anglais, Allemand. Localisation: Dakar, Sénégal. Mobilité: Ouvert au télétravail. Disponibilité: Dans 3 mois. Poste recherché: Infographiste."
256,12,DUT Réseaux et Télécommunications,PMP,"['Illustrator', 'After Effects', 'Prototyping', 'Figma', 'UI Design', 'Wireframing']","['Adaptabilité', 'Créativité', 'Empathie']","['Anglais', 'Espagnol']","Paris, France",Pas mobile,Dans 3 mois,"Expériences: Webdesigner chez TechVentures (2012-2015). Game Designer chez AgileTeam (2014-2016). Graphiste chez TechVentures (2016-2019). Diplômes: DUT Réseaux et Télécommunications. Certifications: PMP. Compétences techniques: Illustrator, After Effects, Prototyping, Figma, UI Design, Wireframing. Compétences comportementales: Adaptabilité, Créativité, Empathie. Langues: Anglais, Espagnol. Localisation: Paris, France. Mobilité: Pas mobile. Disponibilité: Dans 3 mois. Poste recherché: Infographiste."
257,14,MBA Management Digital,Adobe Certified Expert,"['Wireframing', 'Illustrator', 'Unreal Engine', 'Sketch', 'Blender', 'Photoshop']","['Esprit critique', 'Pensée analytique', 'Travail en équipe']","['Français', 'Anglais', 'Espagnol']","Paris, France",Mobile,Dans 1 mois,"Expériences: Webdesigner chez TechCorp (2010-2012). Directeur artistique chez DigitalFirst (2012-2015). UI Designer chez TechCorp (2014-2016). Diplômes: MBA Management Digital. Certifications: Adobe Certified Expert. Compétences techniques: Wireframing, Illustrator, Unreal Engine, Sketch, Blender, Photoshop. Compétences comportementales: Esprit critique, Pensée analytique, Travail en équipe. Langues: Français, Anglais, Espagnol. Localisation: Paris, France. Mobilité: Mobile. Disponibilité: Dans 1 mois. Poste recherché: Infographiste."
258,10,PhD en Intelligence Artificielle,Microsoft Azure Administrator,"['UX Design', 'Wireframing', 'Illustrator', 'Premiere Pro', 'Adobe XD', 'Unity', 'Sketch', 'Blender']","['Pensée analytique', 'Gestion du temps', 'Empathie']","['Français', 'Anglais']","Bamako, Mali",Mobile,Immédiate,"Expériences: UX Designer chez DigitalFirst (2014-2016). Webdesigner chez CloudInnovate (2016-2018). Webdesigner chez DataSolutions (2018-2019). Diplômes: PhD en Intelligence Artificielle. Certifications: Microsoft Azure Administrator. Compétences techniques: UX Design, Wireframing, Illustrator, Premiere Pro, Adobe XD, Unity, Sketch, Blender. Compétences comportementales: Pensée analytique, Gestion du temps, Empathie. Langues: Français, Anglais. Localisation: Bamako, Mali. Mobilité: Mobile. Disponibilité: Immédiate. Poste recherché: Fablab manager."
259,1,Master Design,Adobe Certified Expert,"['CSS', 'Illustrator', 'Adobe XD', 'Design Thinking', 'Prototyping', 'InDesign', 'Unreal Engine', 'HTML']","['Pensée analytique', 'Gestion du temps', 'Empathie']","['Français', 'Arabe']","Bruxelles, Belgique",Pas mobile,Immédiate,"Expériences: Motion Designer chez InnovateLab (2023-2025). Diplômes: Master Design. Certifications: Adobe Certified Expert. Compétences techniques: CSS, Illustrator, Adobe XD, Design Thinking, Prototyping, InDesign, Unreal Engine, HTML. Compétences comportementales: Pensée analytique, Gestion du temps, Empathie. Langues: Français, Arabe. Localisation: Bruxelles, Belgique. Mobilité: Pas mobile. Disponibilité: Immédiate. Poste recherché: Réalisateur de jeux vidéos."
260,7,Diplôme d'ingénieur Informatique,HubSpot Marketing,"['Sketch', 'Unity', 'Adobe XD', 'InDesign', 'CSS', 'Unreal Engine', 'UX Design']","['Empathie', 'Communication', 'Gestion du temps']","['Français', 'Arabe']","Abidjan, Côte d'Ivoire",Pas mobile,Immédiate,"Expériences: Motion Designer chez SmartTech (2017-2019). Webdesigner chez DigitalFirst (2019-2022). Directeur artistique chez DataDriven (2021-2024). Diplômes: Diplôme d'ingénieur Informatique. Certifications: HubSpot Marketing. Compétences techniques: Sketch, Unity, Adobe XD, InDesign, CSS, Unreal Engine, UX Design. Compétences comportementales: Empathie, Communication, Gestion du temps. Langues: Français, Arabe. Localisation: Abidjan, Côte d'Ivoire. Mobilité: Pas mobile. Disponibilité: Immédiate. Poste recherché: UX Designer."
261,12,Diplôme d'ingénieur Logiciel,Kubernetes Administrator,"['Sketch', 'Blender', 'HTML', 'UX Design', 'CSS', 'Premiere Pro', 'Wireframing']","['Créativité', 'Empathie', 'Communication']","['Français', 'Anglais']","Bruxelles, Belgique",Pas mobile,Immédiate,"Expériences: Game Designer chez TechCorp (2012-2013). UX Designer chez InnovateLab (2014-2016). Graphiste chez TechVentures (2016-2017). Diplômes: Diplôme d'ingénieur Logiciel. Certifications: Kubernetes Administrator. Compétences techniques: Sketch, Blender, HTML, UX Design, CSS, Premiere Pro, Wireframing. Compétences comportementales: Créativité, Empathie, Communication. Langues: Français, Anglais. Localisation: Bruxelles, Belgique. Mobilité: Pas mobile. Disponibilité: Immédiate. Poste recherché: Développeur gameplay."
262,5,Master Data Science,AWS Certified Solutions Architect,"['Sketch', 'CSS', 'Unreal Engine', 'Photoshop', 'Blender', 'After Effects']","['Empathie', 'Pensée analytique', 'Leadership']","['Français', 'Arabe']","Abidjan, Côte d'Ivoire",Pas mobile,Dans 3 mois,"Expériences: Directeur artistique chez DigitalFirst (2019-2022). Directeur artistique chez CloudMasters (2021-2023). Diplômes: Master Data Science. Certifications: AWS Certified Solutions Architect. Compétences techniques: Sketch, CSS, Unreal Engine, Photoshop, Blender, After Effects. Compétences comportementales: Empathie, Pensée analytique, Leadership. Langues: Français, Arabe. Localisation: Abidjan, Côte d'Ivoire. Mobilité: Pas mobile. Disponibilité: Dans 3 mois. Poste recherché: Animateur 3D."
263,14,Master Design,Aucune,"['Sketch', 'Unreal Engine', 'Blender', 'HTML', 'Illustrator', 'InDesign']","['Leadership', 'Résolution de problèmes', 'Gestion du temps']","['Français', 'Anglais', 'Allemand']","Lyon, France",Pas mobile,Dans 3 mois,"Expériences: Webdesigner chez CloudInnovate (2010-2013). Directeur artistique chez StartupHub (2012-2015). UI Designer chez AgileTeam (2014-2017). Diplômes: Master Design. Certifications: Aucune. Compétences techniques: Sketch, Unreal Engine, Blender, HTML, Illustrator, InDesign. Compétences comportementales: Leadership, Résolution de problèmes, Gestion du temps. Langues: Français, Anglais, Allemand. Localisation: Lyon, France. Mobilité: Pas mobile. Disponibilité: Dans 3 mois. Poste recherché: Motion Designer."
264,10,DUT Réseaux et Télécommunications,Microsoft Azure Administrator,"['Figma', 'Adobe XD', 'Design Thinking', 'Unity', 'Photoshop', 'Premiere Pro', 'UX Design']","['Pensée analytique', 'Travail en équipe', 'Communication']",['Français'],"Lyon, France",Mobile,Immédiate,"Expériences: Game Designer chez CloudMasters (2014-2015). UX Designer chez CloudInnovate (2016-2018). UX Designer chez AgileTeam (2018-2019). Diplômes: DUT Réseaux et Télécommunications. Certifications: Microsoft Azure Administrator. Compétences techniques: Figma, Adobe XD, Design Thinking, Unity, Photoshop, Premiere Pro, UX Design. Compétences comportementales: Pensée analytique, Travail en équipe, Communication. Langues: Français. Localisation: Lyon, France. Mobilité: Mobile. Disponibilité: Immédiate. Poste recherché: Chargé de production vidéos."
265,11,PhD en Intelligence Artificielle,Microsoft Azure Administrator,"['Wireframing', 'UI Design', 'Illustrator', 'After Effects', 'Premiere Pro', 'Blender', 'Figma', 'Unreal Engine']","['Créativité', 'Esprit critique', 'Pensée analytique']","['Français', 'Arabe']","Bruxelles, Belgique",Mobile,Dans 1 mois,"Expériences: Graphiste chez AgileTeam (2013-2015). UX Designer chez DataSolutions (2015-2016). Webdesigner chez TechVentures (2017-2019). Diplômes: PhD en Intelligence Artificielle. Certifications: Microsoft Azure Administrator. Compétences techniques: Wireframing, UI Design, Illustrator, After Effects, Premiere Pro, Blender, Figma, Unreal Engine. Compétences comportementales: Créativité, Esprit critique, Pensée analytique. Langues: Français, Arabe. Localisation: Bruxelles, Belgique. Mobilité: Mobile. Disponibilité: Dans 1 mois. Poste recherché: Animateur esport."
266,9,PhD en Intelligence Artificielle,Kubernetes Administrator,"['Firewall', 'Wireshark', 'Ansible', 'Python', 'Docker', 'Metasploit', 'AWS', 'PowerShell']","['Empathie', 'Gestion du temps', 'Communication']","['Français', 'Arabe']","Dakar, Sénégal",Pas mobile,Dans 3 mois,"Expériences: Ingénieur DevOps chez TechCorp (2015-2018). Expert sécurité chez TechVentures (2017-2019). Ingénieur Cloud chez CloudInnovate (2019-2022). Diplômes: PhD en Intelligence Artificielle. Certifications: Kubernetes Administrator. Compétences techniques: Firewall, Wireshark, Ansible, Python, Docker, Metasploit, AWS, PowerShell. Compétences comportementales: Empathie, Gestion du temps, Communication. Langues: Français, Arabe. Localisation: Dakar, Sénégal. Mobilité: Pas mobile. Disponibilité: Dans 3 mois. Poste recherché: Conseiller support technique."
267,4,Master Informatique,CEH,"['Bash', 'Kubernetes', 'Docker', 'Linux', 'VPN', 'AWS']","['Pensée analytique', 'Gestion du temps', 'Adaptabilité']",['Français'],"Bamako, Mali",Mobile,Dans 1 mois,"Expériences: Administrateur système chez DataDriven (2020-2022). Expert sécurité chez DataSolutions (2022-2024). Diplômes: Master Informatique. Certifications: CEH. Compétences techniques: Bash, Kubernetes, Docker, Linux, VPN, AWS. Compétences comportementales: Pensée analytique, Gestion du temps, Adaptabilité. Langues: Français. Localisation: Bamako, Mali. Mobilité: Mobile. Disponibilité: Dans 1 mois. Poste recherché: Analyste cybersécurité."
